{
  "catalog_version": "1.1",
  "description": "Catálogo matematizador empresarial núcleo robusto inicial correlacionado con pathology_catalog.v1.json. Primer núcleo ampliado a partir de investigación de fórmulas empresariales y catálogo de patologías PyME.",
  "source_documents": [
    "Fórmulas Matemáticas Empresariales.md",
    "Investigación Fórmulas Matemáticas Empresariales.txt",
    "catalogo_patologias_pyme_v1.md"
  ],
  "status": "robust_operational_catalog",
  "knowledge_tank": "matematizador_empresarial_core_pyme",
  "families": [
    {
      "family_id": "A",
      "name": "Rentabilidad y Margen",
      "scope": "margen, contribución, rentabilidad por producto/cliente/canal"
    },
    {
      "family_id": "B",
      "name": "Costos",
      "scope": "costos fijos, variables, unitarios, punto de equilibrio, reposición"
    },
    {
      "family_id": "C",
      "name": "Precios / Pricing",
      "scope": "markup, margen objetivo, elasticidad, drift de precios"
    },
    {
      "family_id": "D",
      "name": "Ventas y Comercial",
      "scope": "ticket, conversión, crecimiento, concentración, churn"
    },
    {
      "family_id": "E",
      "name": "Caja y Liquidez",
      "scope": "flujo de caja, capital de trabajo, DSO, DPO, DIO, CCC"
    },
    {
      "family_id": "F",
      "name": "Finanzas Corporativas",
      "scope": "ROI, ROA, ROE, EBITDA, deuda, cobertura"
    },
    {
      "family_id": "G",
      "name": "Inventario / Stock",
      "scope": "rotación, stock seguridad, reposición, merma, capital inmovilizado"
    },
    {
      "family_id": "H",
      "name": "Producción / Operaciones",
      "scope": "productividad, capacidad, OEE, defectos, throughput"
    },
    {
      "family_id": "K",
      "name": "Impuestos / Fiscal Operativo",
      "scope": "IVA, saldo técnico, presión fiscal, recategorización"
    },
    {
      "family_id": "M",
      "name": "Automatización / ROI Tecnológico",
      "scope": "horas manuales, payback, ROI, costo de error"
    },
    {
      "family_id": "N",
      "name": "Riesgo y Control",
      "scope": "concentración, aging, sensibilidad, estrés de caja"
    }
  ],
  "formulas": [
    {
      "formula_id": "LIQ_001_vendido_cobrado",
      "canonical_formula_id": "E13",
      "pathology_code": "LIQ_001",
      "name": "Descalce vendido cobrado",
      "family_id": "E",
      "category": "liquidez",
      "expression": "sold_amount - collected_amount",
      "display_expression": "Vendido - Cobrado",
      "required_variables": [
        "sold_amount",
        "collected_amount"
      ],
      "required_evidence": [
        "ventas_del_periodo",
        "cobranzas_del_periodo",
        "cuentas_corrientes_clientes"
      ],
      "output_unit": "currency",
      "calculation_state": "CALCULABLE",
      "priority_mvp": "alta",
      "interpretation": "Diferencia monetaria entre lo vendido y lo efectivamente cobrado; cuantifica tensión de caja por cobranza pendiente.",
      "priority_robustez": "alta"
    },
    {
      "formula_id": "REN_001_margen_neto_real",
      "canonical_formula_id": "A02",
      "pathology_code": "REN_001",
      "name": "Margen neto real",
      "family_id": "A",
      "category": "rentabilidad",
      "expression": "((sale_price - costs - taxes) / sale_price) * 100",
      "display_expression": "((PV - Costos - Impuestos) / PV) × 100",
      "required_variables": [
        "sale_price",
        "costs",
        "taxes"
      ],
      "required_evidence": [
        "ventas_del_periodo",
        "costos_directos",
        "impuestos_y_comisiones"
      ],
      "output_unit": "percentage",
      "calculation_state": "CALCULABLE",
      "priority_mvp": "alta",
      "interpretation": "Mide si la venta conserva rentabilidad después de costos e impuestos; útil para detectar margen invisible o falsa rentabilidad.",
      "priority_robustez": "alta"
    },
    {
      "formula_id": "REN_002_coeficiente_reposicion",
      "canonical_formula_id": "A11",
      "pathology_code": "REN_002",
      "name": "Coeficiente de reposición",
      "family_id": "A",
      "category": "rentabilidad",
      "expression": "closing_index / origin_index",
      "display_expression": "Índice Cierre / Índice Origen",
      "required_variables": [
        "closing_index",
        "origin_index"
      ],
      "required_evidence": [
        "indice_origen",
        "indice_cierre",
        "fecha_origen",
        "fecha_cierre"
      ],
      "output_unit": "ratio",
      "calculation_state": "CALCULABLE",
      "priority_mvp": "media",
      "interpretation": "Actualiza valores históricos para contrastar rentabilidad nominal contra costo de reposición.",
      "priority_robustez": "media"
    },
    {
      "formula_id": "INV_001_punto_reposicion",
      "canonical_formula_id": "G05",
      "pathology_code": "INV_001",
      "name": "Punto de reposición",
      "family_id": "G",
      "category": "inventario",
      "expression": "(average_sales * lead_time) + safety_stock",
      "display_expression": "(Venta Promedio × Lead Time) + Stock Seguridad",
      "required_variables": [
        "average_sales",
        "lead_time",
        "safety_stock"
      ],
      "required_evidence": [
        "historial_ventas_sku",
        "lead_time_proveedor",
        "politica_stock_seguridad"
      ],
      "output_unit": "units",
      "calculation_state": "CALCULABLE",
      "priority_mvp": "alta",
      "interpretation": "Indica nivel mínimo de stock para disparar compra antes de quiebre operativo.",
      "priority_robustez": "alta"
    },
    {
      "formula_id": "LIQ_002_saldo_final_proyectado",
      "canonical_formula_id": "E03",
      "pathology_code": "LIQ_002",
      "name": "Saldo final proyectado",
      "family_id": "E",
      "category": "liquidez",
      "expression": "initial_balance + expected_collections - expected_payments",
      "display_expression": "Saldo Inicial + Cobros - Pagos",
      "required_variables": [
        "initial_balance",
        "expected_collections",
        "expected_payments"
      ],
      "required_evidence": [
        "saldo_inicial_caja_banco",
        "cobranzas_esperadas",
        "pagos_esperados"
      ],
      "output_unit": "currency",
      "calculation_state": "CALCULABLE",
      "priority_mvp": "alta",
      "interpretation": "Proyecta caja disponible; detecta riesgo de flujo de caja sin anticipación.",
      "priority_robustez": "alta"
    },
    {
      "formula_id": "INV_002_rotacion_stock",
      "canonical_formula_id": "G01",
      "pathology_code": "INV_002",
      "name": "Rotación de inventario",
      "family_id": "G",
      "category": "inventario",
      "expression": "cost_of_goods_sold / average_stock",
      "display_expression": "CMV / Stock Promedio",
      "required_variables": [
        "cost_of_goods_sold",
        "average_stock"
      ],
      "required_evidence": [
        "cmv_periodo",
        "inventario_inicial",
        "inventario_final"
      ],
      "output_unit": "ratio",
      "calculation_state": "CALCULABLE",
      "priority_mvp": "alta",
      "interpretation": "Mide cuántas veces se renueva el inventario; rotación baja sugiere capital inmovilizado.",
      "priority_robustez": "alta"
    },
    {
      "formula_id": "OPE_001_decisiones_centralizadas",
      "canonical_formula_id": "L07",
      "pathology_code": "OPE_001",
      "name": "Porcentaje de decisiones centralizadas",
      "family_id": "L",
      "category": "operaciones",
      "expression": "owner_decisions / total_decisions * 100",
      "display_expression": "% Decisiones Dueño > 80%",
      "required_variables": [
        "owner_decisions",
        "total_decisions"
      ],
      "required_evidence": [
        "registro_decisiones",
        "workflow_aprobaciones",
        "entrevista_dueño"
      ],
      "output_unit": "percentage",
      "calculation_state": "CALCULABLE_CON_SUPUESTOS",
      "priority_mvp": "media",
      "interpretation": "Estima dependencia del dueño y riesgo de cuello de botella organizacional.",
      "priority_robustez": "media"
    },
    {
      "formula_id": "PYME_004_recpam_basico",
      "canonical_formula_id": "J10",
      "pathology_code": "PYME_004",
      "name": "RECPAM básico por coeficiente",
      "family_id": "J",
      "category": "fiscal_contable",
      "expression": "origin_value * (closing_index / origin_index - 1)",
      "display_expression": "Valor Origen × (Coeficiente - 1)",
      "required_variables": [
        "origin_value",
        "closing_index",
        "origin_index"
      ],
      "required_evidence": [
        "valor_origen",
        "indice_origen",
        "indice_cierre",
        "fecha_origen"
      ],
      "output_unit": "currency",
      "calculation_state": "CALCULABLE_CON_SUPUESTOS",
      "priority_mvp": "media",
      "interpretation": "Cuantifica efecto inflacionario sobre partidas no monetarias; requiere validación contable.",
      "priority_robustez": "media"
    },
    {
      "formula_id": "PYME_011_dso",
      "canonical_formula_id": "E09",
      "pathology_code": "PYME_011",
      "name": "Días de ventas por cobrar",
      "family_id": "E",
      "category": "cobranzas",
      "expression": "accounts_receivable / sales * days",
      "display_expression": "(Cuentas por Cobrar / Ventas) × Días",
      "required_variables": [
        "accounts_receivable",
        "sales",
        "days"
      ],
      "required_evidence": [
        "cuentas_por_cobrar",
        "ventas_periodo",
        "periodo_dias"
      ],
      "output_unit": "days",
      "calculation_state": "CALCULABLE",
      "priority_mvp": "alta",
      "interpretation": "Mide plazo promedio de cobro; aumento silencioso tensiona caja.",
      "priority_robustez": "alta"
    },
    {
      "formula_id": "PYME_013_dso_dpo_gap",
      "canonical_formula_id": "E08",
      "pathology_code": "PYME_013",
      "name": "Descalce DSO vs DPO",
      "family_id": "E",